,tweet_text,pos_rev,polarity,review_len,word_count
1676,rt mention less hour announce detail ipad giveaway sxsw sxswi,1,-0.16666666666666666,61,10
1677,rt mention less half hour we'll tell win ipad rt sxsw sxswi,1,0.15555555555555559,59,12
1678,rt mention line source code even longer ipad take apple sxsw,0,0.0,60,11
1679,rt mention line ppl around block sxsw party apple store insane link,1,-1.0,67,12
1680,rt mention lonely planet release free austin city guide iphone app sxsw like enough apps cluttering handset,0,0.10000000000000002,107,17
1681,rt mention look everyone zomg mention get ipad first day sxsw link,1,0.25,66,12
1682,rt mention look cool new iphone twitter app track action sxsw week check link tweetignite,1,0.19545454545454544,89,15
1683,rt mention look fwd ipad dj mention mention dark party tonight great first day sxsw link,1,0.3,88,16
1684,rt mention look like fun session sxsw quot;mistakes make build nextflix iphone&quot link,1,0.3,88,13
1685,rt mention love mention sxsw quot;apple come cool technology one's ever hear go conferences&quot,1,0.425,96,14
1686,rt mention love mention sxsw quot;apple come cool technology one's ever hear link,1,0.425,81,13
1687,rt mention love mention sxsw quot;apple come cool technology one's ever hear go conferences&quot,1,0.425,96,14
1688,rt mention love sxsw quot;apple come cool technology one's ever hear go conferences&quot,1,0.425,88,13
1689,rt mention love mention set pop-up store amp congress deal mass geek influx release sxsw,1,0.5,88,15
1690,rt mention rt mention love sxsw quot;apple come cool technology one's ever hear go conferences&quot,1,0.425,99,15
1691,rt mention mindjet go sxsw celebrate give away ipad find enter link,1,0.0,67,12
1692,rt mention sxsw awesomeness apple open temporary store downtown austin sxsw ipad launch link,1,0.0,92,14
1693,rt mention mr heavenly aka band michael cera ready rock bat bar sxsw iphone camera de rigeur,1,0.2,92,17
1694,rt mention exclusive apple ipad review still well rest link bnet biz apple sxsw ipad,1,0.0,84,15
1695,rt mention informal unscientific observation apple far computer choice sxsw hand link,1,0.1,85,12
1696,rt mention informal unscientific observation apple far computer choice sxsw hand contest,1,0.1,88,12
1697,rt mention mypov winner popup apple store chevy cruze loser investor prop frothy startup enterprise strategy sxsw,1,0.0,113,17
1698,rt mention need workspace book iphone link mention app sxsw virtualoffice,1,0.0,73,11
1699,rt mention new sxsw rule ooing ahing new ipad get big deal everybody one,0,0.0909090909090909,72,14
1700,rt mention new ubersocial iphone app store include uberguide sxsw sponsor mashable cont link,1,0.13636363636363635,92,14
1701,rt mention new ubersocial iphone app store include uberguide sxsw link,1,0.13636363636363635,70,11
1702,rt mention new ubersocial iphone app store include uberguide sxsw sponsor mashable link,1,0.13636363636363635,87,13
1703,rt mention new ubersocial iphone include uberguide sxsw sponsor mashable link lt nicely do,1,0.36818181818181817,90,14
1704,rt mention new ipad apps speech therapy communication showcased sxsw mention link,1,0.13636363636363635,81,12
1705,rt mention new ipad apps speech therapy communication showcased sxsw conference link sxswi sxsh sxswh hcsm slp,1,0.13636363636363635,110,17
1706,rt mention new iphone autocorrect already tried change quot;coworkers&quot quot;visigoths.&quot go long five day sxsw,0,0.043181818181818175,117,15
1707,rt mention new mike tyson game come iphone link iphone sxsw videogames tyson art cartoon,1,-0.13181818181818183,88,15
1708,rt mention new post mention iphone app make easy connect social network people meet link sxsw,1,0.201010101010101,93,16
1709,rt mention news ipad go enterprise mention say first look new ûïviewû app link tip mention sxsw,1,0.19318181818181818,98,17
1710,rt mention stumble around lose sxsw stay contact group mention iphone application link,1,-0.05,86,13
1711,rt mention fan new sxsw trend audience share opinion via hold ipad listen annoy,0,0.13636363636363635,79,14
1712,rt mention note self downside tweet white ipad expect mock mention sxsw,0,0.0,71,12
1713,rt mention nothing say douche cake like walk around ipad like iphone sxsw,0,0.0,73,13
1714,rt mention novelty ipad news apps fade fast among sxsw delegate mention link,0,0.2,76,13
1715,"rt mention nyt app ipad quot;here's amaze way serve readership,&quot quot;here's market opportunity can't ignore.&quot sxsw newsapps",1,0.0,132,17
1716,rt mention oh god rt mention rumor apple open temp store austin sxsw amp;ipad launch link,1,0.0,89,16
1717,rt mention oh god rt mention rumor apple open temporary store downtown austin sxsw amp;ipad launch link,1,0.0,103,17
1718,rt mention second day business apple pop-up store appear trend sxsw vb mention apple store sxsw pic link,1,0.0,104,18
1719,rt mention early nerdbird sxsw get mention iphone app share photos airport people like people wal-mart airport,1,0.1,110,17
1720,rt mention airline mention guy kawasaki delightful like apple drumroll mention congrats sxsw,1,1.0,92,13
1721,rt mention sxsw quot;my iphone tell know mean winning&quot mention,1,-0.3125,66,10
1722,rt mention ooooo apple rumor open temporary store sxsw link,1,0.0,59,10
1723,rt mention update iphone app song info select stream incl mention amp live video stream time sxsw link,1,0.13636363636363635,102,18
1724,rt mention people line apple store downtown austin sxsw,1,0.0,55,9
1725,rt mention panel get head ipad say quot;{link loud newsapps sxsw,1,0.1,64,11
1726,rt mention papa sangre immersive audio game iphone free today highly recommend papasangre sxsw,1,0.05333333333333334,94,14
1727,rt mention perfect sxsw iphone app home screen organization link like,1,1.0,69,11
1728,rt mention pic ipad-winning performance link sxsw accordion toodamnlucky,1,0.0,72,9
1729,rt mention play fave new iphone app mention wow rock sxsw next week,1,0.07878787878787878,67,13
1730,rt mention poor austin rt mention ipad launch coincides fri afternoon sxsw apple store employee austin may begin weep,1,-0.4,117,19
1731,rt mention qrafter well pay free qr code apps scan vcards also download qrcode iphone sxsw,1,0.4,90,16
1732,rt mention really find enjoy ipad design principle well do tapworthy useful clear point throughout sxsw,1,0.25000000000000006,103,16
1733,rt mention rt mention apple open pop-up store austin sxsw link exactly want,1,0.125,75,13
1734,rt mention rt mention mention put gun mention head give iphone sxsw link,1,0.0,72,13
1735,"rt mention rt mention apple quot;the classy fascist company america,&quot say mention sxsw",0,0.1,90,13
1736,rt mention rt mention best thing i've hear weekend sxsw quot;i give ipad money japan relief need ipad,1,1.0,101,18
1737,rt mention rt mention best thing i've hear weekend sxsw quot;i give ipad money japan relief need ipad mention,0,1.0,109,19
1738,rt mention rt mention forward delicious t-mobile austin iphone user struggle anything sxsw,0,1.0,90,13
1739,rt mention rt mention hear apple's pop-up store downtown austin pic already gowalla link sxsw pop-pop,1,0.0,101,16
1740,rt mention rt mention next life i'm come back ipad woman can't keep hand thing sxsw,1,0.0,83,16
1741,rt mention rt mention rumor apple open temporary store downtown austin sxsw launch link,1,0.0,87,14
1742,rt mention rt mention rumor apple open temporary store downtown austin sxsw ipad launch link,1,0.0,92,15
1743,rt mention rt mention talk mike tyson sxsw new iphone game let fight pauly celebs link,1,-0.13181818181818183,86,16
1744,rt mention rt mention love mention sxsw quot;apple come cool technology one's ever hear go conferences&quot,1,0.425,107,16
1745,rt mention rt mention love mention sxsw quot;apple come cool technology one's ever hear go conferences&quot,1,0.425,107,16
1746,rt mention rt mention new ubersocial iphone app store include uberguide sxsw sponsor mashable link,1,0.13636363636363635,98,15
1747,rt mention rt mention sound voice shot exploit apple amp best buy's return policy imacs brilliant sxsw,0,0.7666666666666666,102,17
1748,rt mention rt mention texas observer tomlinson say would double revenue per issue ipad subscription newsapps sxsw,1,0.0,113,17
1749,rt mention rt mention day bank america launch iphone app get new customer bankinnovation sxsw,1,0.13636363636363635,93,15
1750,rt mention rt mention ipad take sxsw video link,1,0.0,47,9
1751,rt mention rt mention give away ipad kick time sxsw visit fb page info link,1,0.0,75,15
1752,rt mention rt mention lose hour tonight sxsw attendee blame microsoft apple get credit fix christmas,1,0.0,100,16
1753,rt mention rt mention we're officially sxsw come mention grill mention zazzlsxsw youûªll get make iphone case,1,0.0,110,17
1754,rt mention rt mention yes update iphone app song info mention stream others also live video stream sxsw link,1,0.13636363636363635,108,19
1755,rt mention rt haha awesomely rad ipad app mention link hollergram sxsw via mention mention,1,0.6,90,15
1756,rt mention rt rumor apple open temporary store downtown austin sxsw ipad launch link,1,0.0,84,14
1757,rt mention rt@mention love mention sxsw quot;apple come cool technology one's ever hear go conferences&quot,1,0.425,107,15
1758,rt mention rumor apple store open sxsw amp congress sign point yes link,1,0.0,71,13
1759,rt mention save photo apple store sxsw link mention mention mention dr_black jerranalley tbalinas,1,0.0,97,14
1760,rt mention see member team carry one bag sxsw show wolfram|app amp get w|a iphone case link,1,0.0,91,17
1761,rt mention see new texas observer ipad app sxswi sheraton sxsw,1,0.13636363636363635,62,11
1762,rt mention send waaaambulance rt mention get ipad i'm sxsw yes depress,0,-0.06666666666666667,70,12
1763,rt mention set pop shop mention sxsw smart move ipad imho developer matter ipad link,1,0.21428571428571427,84,15
1764,rt mention shut rt mention rumor apple open temp store downtown austin sxsw amp ipad launch link,1,0.0,96,17
1765,rt mention slide sxsw talk quot;ipad design headache quot link tapworthy really interesting designer well,0,0.5,105,15
1766,rt mention smart company rt mention rumor apple open temporary store downtown austin sxsw amp;ipad launch,1,0.10714285714285714,105,16
1767,rt mention smartphone breakdown sxsw unofficial iphones android blackberry symbian window,1,0.0,89,11
1768,rt mention kickass iphone developer sxsw want something cool follow shoot note,1,0.35,78,12
1769,rt mention speak truth watch apple staff temp sxsw store high five entire long line facepalmed ugh longlinesbadux,0,0.03666666666666667,113,18
1770,rt mention spin play new concept music discovery ipad mention amp spin.com link itunes sxsw mention,1,0.13636363636363635,99,16
1771,rt mention spot sxsw man need ipad ûò link sxswi,1,0.0,49,10
1772,rt mention still think awesome smileyparty sxsw go give ipad please,1,1.0,67,11
1773,rt mention stop let make custom iphone case zazzlesxsw sxsw sxswi link link,1,0.0,75,13
1774,rt mention strange little japan news penetrates sxsw bubble bar tv cnn suggest anything important ipad go fb,1,0.054166666666666675,108,18
1775,rt mention sweet apple's open pop-up shop scarbrough building congress ipad link via mention sxsw,1,0.175,97,15
1776,rt mention sxsw novelty ipad news apps fade fast among digital delegate link sxsw,0,0.1,81,14
1777,rt mention sxsw get apple store link atx,1,0.0,40,8
1778,rt mention temp apple store st austin sxsw close night quot;they're stuff say austin cop bar door,0,0.0,97,17
1779,rt mention temp apple store kill austin sell early every day sxsw,1,0.1,65,12
1780,rt mention temporary sxsw apple store apple sneaky usual link,0,-0.25,61,10
1781,rt mention thank rt mention pick mention book killer photoes iphone sxsw sxswchi link sxswi,1,0.0,91,15
1782,rt mention mention iphone app unreal click location leanstartup amp person tell still seat sxsw,1,0.0,95,15
1783,rt mention ipad take sxsw video link sxswi,1,0.0,42,8
1784,"rt mention ipad take sxsw video link via mashable
#apple",1,0.0,56,10
1785,rt mention beluga iphone app highlight sxsw excellent way coordinate relief effort,1,1.0,82,12
1786,rt mention ipad go sale next friday...the austin apple store go busy sxsw,1,0.05,73,13
1787,rt mention ipad thin could use cut line cocaine facetime mel gibson win sxsw,1,0.2,76,14
1788,rt mention ipad also cartoonishly large digital camera sxsw cstejas link,0,0.10714285714285714,72,11
1789,rt mention ipad take sxsw video one big event first day sxsw link,1,0.125,65,13
1790,rt mention ipad take sxsw video link,1,0.0,36,7
1791,rt mention ironic tee usurp ipad hipster/geek/start-up chic fashion item year's sxsw,1,0.2,84,12
1792,rt mention valuable device sxsw far apple ipod iphone charger,1,0.1,61,10
1793,rt mention new whrrl app live iphone app store android marketplace get hot time sxsw,1,0.17424242424242423,84,15
1794,mention hand judge pop-up store constant line apple clearly break sxsw,1,0.05000000000000001,70,11
1795,everyone plane austin look like go sxsw mean apple product hipster clothes,1,-0.3125,74,12
1796,rt mention session designingforkids change mind future kid's relationship iphone sapient sxsw,1,0.0,93,12
1797,mention upside sxsw start today ipad release,1,0.0,44,7
1798,rt mention iphone apps keep groove sxsw mention link,1,0.0,52,9
1799,rt mention everywhere crazy look around sxsw realize last year one ipad sxsw,1,-0.3,76,13
1800,mention think may coin new term quot;apptrophy.&quot happen unused iphone apps disuse apptrophy sxsw,0,0.13636363636363635,100,14
1801,rt mention mention article sxsw good i'm link iphone train link,1,0.7,63,11
1802,rt mention group next ppl mention table everyone use thier phone/ipad instead take sxsw,0,0.0,87,14
1803,rt mention awesome get ipad sxsw link mention via mention,1,1.0,57,10
1804,rt mention one three best apps we've see sxsw link,1,1.0,50,10
1805,rt mention thrill former chief talent officer apple gap mention advisory board link sxsw sxswi innotribe,1,0.0,104,16
1806,rt mention tim soo's invisible instrument jaw drop iphone+wii controller link openexhibits sxsw,1,0.0,95,13
1807,rt mention kick sxswi mention give away ipad visit fb page enter link sxsw,1,0.0,74,14
1808,rt mention tron amaze idea blue ray release screen ipad app syncs movie follow additional content sxsw,1,0.0,102,17
1809,rt mention true rt mention rumor apple open temporary store downtown austin sxsw amp ipad launch link,1,0.175,101,17
1810,rt mention turn ipad physical messaging platform holler gram cheeky app build sxsw link,1,0.0,87,14
1811,rt mention umm would mention ûï@mention keep win shit thanks mention killer ipad case sxswû,1,0.26666666666666666,94,15
1812,rt mention update npr music iphone app song info song amp live video stream time sxsw link,1,0.13636363636363635,90,17
1813,rt mention happy discovr name one top ten must-have apps ipad fight way thru queue sxsw,1,0.43333333333333335,87,16
1814,rt mention smart mention hollergram ipad app sxsw link may leave vuvuzela home,1,0.21428571428571427,78,13
1815,rt mention smart move apple pop-up store sxsw ipad come tomorrow link,1,0.21428571428571427,69,12
1816,rt mention smart rt mention aapl open pop store ipad sale sxsw link,1,0.10714285714285714,67,13
1817,rt mention via mention still big line outside apple's pop-up shop day ipad's debut sxsw,1,0.0,87,15
1818,rt mention video first unboxing outside apple store sxsw come soon find decent wifi,1,0.13888888888888887,83,14
1819,rt mention mention write hollergram ipad app sxsw link,1,0.0,54,9
1820,rt mention include emotional thing ipad barrydiller sxsw pnid,1,0.0,61,9
1821,rt mention excite see hls dynamic video ad insertion tv everywhere work later today sxsw popup apple store,1,0.0,106,18
1822,rt mention can't wait give ipad someone sxsw want head www.pep.jobs/upc enter must present win,1,0.4,94,15
1823,rt mention launch ipad app sxsw get detail first edition free link,1,0.325,66,12
1824,rt mention launch spin's ipad app sxsw ton music photo videos whatcha think link,1,0.0,80,14
1825,rt mention lose hour tonight sxsw attendee blame microsoft apple get credit fix christmas,1,0.0,89,14
1826,rt mention lose hour sxsw attendee blame microsoft apple get credit fix christmas,1,0.0,81,13
1827,rt mention we've get exciting thing we'll show sxsw year include drag drop store management iphone,1,0.09999999999999999,98,16
1828,rt mention web developer havenûªt try new relic sign sxsw enter win ipad come booth link,1,0.4681818181818182,89,16
1829,rt mention well forget nfl lockout right gonna focus get shinmy new ipad sxsw apple make happy nfl,1,0.40735930735930737,98,18
1830,rt mention well i'm first line hour go ipad apple sxsw sleepy,1,0.25,61,12
1831,rt mention bore keynote sxsw use ipad draw picture even good artist link sxswi,1,0.7,78,14
1832,rt mention smartphone rule sxsw definitely iphone apple smartphone i've eyeball,1,0.0,79,11
1833,rt mention whoa hang saw someone without iphone sxsw,1,0.0,52,9
1834,rt mention win ipad come meet aquent talent agent drop name sxsw booth link,1,0.8,75,14
1835,rt mention win awesome ipad quibids custom mention case catch sxsw wear openbeta vip badge,1,0.9,90,15
1836,rt mention within hour buy ipad glenda watson hyatt cerebral palsy able communicate stranger public sxsw poursite,1,0.25,113,17
1837,rt mention wake sandwich iphone ipad forget much sxsw like geek spring break,1,0.2,76,13
1838,rt mention place fandango karaoke prize yr fandango tkts useless canada prize useful ipad sxsw,1,-0.1,94,15
1839,rt mention woo hoo mention finally back iphone link sxsw il,1,0.0,59,11
1840,rt mention wooooo mention release discovr iphone time sxsw new feature link,1,0.13636363636363635,75,12
1841,rt mention word motherboard rt mention want iphone apps head sxsw today hot one link,1,0.25,84,15
1842,rt mention wow mention develop ipad app newsapps sxsw,1,0.1,53,9
1843,rt mention wow thing insanely thin amp light hold ipad seriously sxsw mosaicxm link,1,-0.058333333333333334,83,14
1844,rt mention wow shakespeare's pub st here's delete button iphone video camera sxsw,1,0.1,81,13
1845,rt mention yes hate fanboys still valid tho wait instead enjoy sxsw link,0,-0.2,72,13
1846,rt mention yes rumor true come play mention ipad booth sxsw exhibit hall ipad giant quot;o&quot,1,0.175,95,16
1847,rt mention yes update iphone app song info mention stream others also live video stream sxsw link,1,0.13636363636363635,97,17
1848,rt mention yes update iphone app song info mention stream others also live video stream sxsw link,1,0.13636363636363635,97,17
1849,rt mention yes update iphone app song info mention stream others also live video stream sxsw link,1,0.13636363636363635,97,17
1850,rt mention yesterday fantastic mention sxsw amp;apple ipad launch let's take moment suffer japan,1,0.4,96,14
1851,rt mention zazzle officially sxsw come mention grille mention zazzlsxsw youûªll get make iphone case,1,0.0,101,15
1852,sxsw iphone app control mania half screen use button filter half content ui-fail,0,-0.16666666666666666,80,13
1853,iphone apps keep groove sxsw mention link,1,0.0,41,7
1854,iphone apps keep groove sxsw mention link via mention,1,0.0,53,9
1855,someone buy ipad wait line get tomorrow sxsw,1,0.0,44,8
1856,fuck iphone crap charge say charge night option austin sxsw,0,-0.6000000000000001,59,10
1857,mention one must apps survive sxsw link join sxswbarcrawl sxswi,1,0.0,63,10
1858,tip conference goer everywhere bring ipad leave laptop hotel i've battery sore shoulder week sxsw,1,0.0,97,15
1859,amuse long line temp apple store starbu cks acrosse street people seem unpack sxsw,1,-0.05,82,14
1860,congress dude creatively save ipad www.socialmediabum.tumblr.com sxsw link,1,0.5,74,8
1861,awesome conversation network line sxsw apple store,1,1.0,50,7
1862,social proof powerful marketing motivator see white earbud headphone cable know apple mention sxsw,1,0.1111111111111111,98,14
1863,jqtouch look amazing apple theme make web page look like native iphone apps sxsw geekery,1,0.6000000000000001,88,15
1864,look stupid take pix ipad believe guy sxsw,0,-0.7999999999999999,42,8
1865,cool apps come sxsw make miss iphone big way,1,0.175,44,9
1866,kind cool someone try screen mirror ipad via camera hdmi cable gent sxsw,1,0.475,72,13
1867,line pop apple store austin first person a.m.they wait p.m sxsw link,0,0.25,68,12
1868,apple's pop-up store sxsw day release could genius move marketing history,1,0.0,73,11
1869,apple's pop-up store sxsw like girl scout plant next bank atm ca$h money thinmints,1,0.0,82,14
1870,apple's pop-up store plan sxsw austin link,1,0.0,42,7
1871,apple open pop-up store sxsw wannabe-hipsters feel home near fav store link,1,0.05,75,12
1872,apple open popup shop mention core sxsw action brilliant bring hot shiny new toy sxsw peep link,1,0.2772727272727272,95,17
1873,apple open popup store sxsw ipad launch genius bastard link,1,0.0,59,10
1874,apple open temporary store austin sxsw people obviously want shell macbook visit austin,0,0.0,87,13
1875,apple open temporary store austin sxsw people obviously want shell macbook,0,0.0,74,11
1876,apple open temporary store downtown austin march accommodate sxsw attendee god fuck smart,1,-0.061904761904761914,89,13
1877,apple open temp retail store austin sell ipads sxsw attendee tempt,1,0.0,66,11
1878,apple open temporary store close sxsw sell get influencers concept link mention,1,0.0,79,12
1879,apple open temporary store sxsw conference ipad launch might make stop,1,0.0,70,11
1880,people back home seem sxsw put together pop-up apple store people get today,1,0.0,75,13
1881,pack sxsw macbook ipad ahhh can't decide,1,0.0,40,7
1882,wait bestie come mention popup store ipad sxsw apple,1,0.0,52,9
1883,"nyt app ipad quot;here's amaze way serve readership,&quot quot;here's market opportunity can't ignore.&quot sxsw newsapps",0,0.0,121,15
1884,sxsw rumor mill ipad camera slightly thinner rare earths case quot;different&quot still smudgy screen,0,0.06666666666666667,101,14
1885,line apple hype team make high-five run sxsw,1,0.0,44,8
1886,die antwoord awesome umshini wam korine park's night fish amaze especially shot iphone sxsw,1,0.5,91,14
1887,quot;before even begin apple win sxsw&quot apple setup temporary store austin ipad launch march link,1,0.8,100,15
1888,tech even begin apple win sxsw link technology,1,0.8,46,8
1889,tech even begin apple win sxsw past week there's major dilemma link technology,1,0.2041666666666667,78,13
1890,tech even begin apple win sxsw link,1,0.8,35,7
1891,hooray long line rt mention apple open temporary store downtown austin sxsw amp ipad launch link,1,-0.025,96,16
1892,look forward delicious t-mobile austin iphone user struggle anything sxsw,0,1.0,73,10
1893,look forward hear lynn teo tell nice thing probably already know ipad navigation uxdes sxsw,1,0.6,91,15
1894,look forward learn ipad design sxsw,1,0.0,35,6
1895,look forward see ipad site alphagraphics buy laser print scarborough building sxsw,1,0.0,82,12
1896,look forward iphone android design session sxsw can't wait drink give away stuff get pay,1,0.0,88,15
1897,look forward visit apple store come congress ave sxsw apple sell ipad,1,0.0,69,12
1898,post sxsw make jealous btw sxsw auto corrects ass's ipad joke check,0,0.0,67,12
1899,ipad game changer new game multiplicity option either someone p[ay content sxsw,0,-0.22121212121212122,79,12
1900,finally get new iphone tweet phone time sxsw gah torture addictedtotheinterwebs,1,0.06818181818181818,79,11
1901,quot;no reason apple's continue survival existence god&quot mention enchantment sxsw sxswi,0,0.0,90,11
1902,sxsw hootsuite chilltab tablet stand rock canadian social medium ipad best mention link,1,0.5166666666666667,87,13
1903,sxsw folk take note ipad sure download dan bricklin's app notetaker really sweet thanks mention,1,0.35000000000000003,95,15
1904,help clean organize news/content mention great job ipad owner sxsw sxswi,1,0.5833333333333334,72,11
1905,guy like presentation mention sxsw wanna try filmaster iphone,1,0.0,61,9
1906,twitter fail last time force choke iphone sxsw,0,-0.25,46,8
1907,mention ouch look like might able grab one sxsw temp apple store,1,0.5,64,12
1908,glad bring mac sxsw pc clearly cool environment may walk around theplatform ipad,1,0.425,80,13
1909,life would much well ipad brainwash line sxsw,1,0.2,45,8
1910,mention android amp iphone app launch sxsw also keep handy lil device update w/event info link eventseekr,1,0.6,105,17
1911,word motherboard rt mention want iphone apps head sxsw today hot one link,1,0.25,73,13
1912,phone stay charge crappy iphone would never handle sxsw rt mention mention mention sleep crazyfest,0,0.0,98,15
1913,four south african cap plane trip sxsw nine-hour wait ipad line...{link,1,0.0,71,11
1914,part journalsim support democracy yes inform populous yes ipad focus support newsapps sxsw,0,0.0,90,13
1915,jealous see people ipad take photo iwantacameraonmyipad sxsw,1,0.0,60,8
1916,check ipad mention sxsw pop-up store mention apple store sxsw others link,1,0.0,73,12
1917,pen ink miamibeach iphone sxsw next week,1,0.0,40,7
1918,check apple pop store look fwd check ipad sxsw mosaicxm mk link,1,0.0,63,12
1919,check new fast society app iphone kinda like group foursquare nice sxsw thanks mention share,1,0.28409090909090906,92,15
1920,check great amp effective enviro app mention bin link iphone sxsw sxswi greatergood,1,0.7,83,13
1921,line outside pop-up apple store crazy-long festival get entertaining every day sxsw,1,0.25,83,12
1922,bank innovate die great session customer join bank america release iphone app&quot sxsw,1,0.8,87,13
1923,totally love copia cocoon messenger ipad bag pick attend redbox/gilt group/graphic.ly sesh morning sxsw,1,0.5,103,14
1924,anyone know hour sxsw apple store kinda hop open hour,1,0.0,53,10
1925,anyone know line like popup apple store sxsw,1,0.0,44,8
1926,know geek cross road take picture apple pop-up store sxsw link,1,0.0,62,11
1927,set pop shop mention sxsw smart move ipad imho developer matter ipad link,1,0.21428571428571427,73,13
