,tweet_text,pos_rev,polarity,review_len,word_count
1148,really like sxsw iphone app thanks make event app appear work well,1,0.2,66,12
1149,survival kit provide folk line sxsw apple store morning genius link,1,0.0,67,11
1150,mention know mention awesome ipad/iphone app likely appreciate design also they're give free sxsw,1,0.4666666666666666,97,14
1151,playhopskoch apple app store well android market get ready rock sxsw,1,0.2,68,11
1152,quot;desktop publishing save apple pagemaker gift god.&quot mention sxsw,1,0.0,72,9
1153,device ipad one hang entire day sxsw remain others die hour ago,1,0.0,63,12
1154,msft panel touch interface show bunch tablet ipad sxsw dontbehatin,1,0.0,66,10
1155,quot;will take time others catch ipad.&quot mention tapworthy sxsw,1,0.0,66,9
1156,super cool apple's pop store sxsw office building link mention sxswi austin,1,0.3416666666666667,75,12
1157,prize sxsw apple product sigh,0,0.0,29,5
1158,place fandango karaoke prize yr fandango tkts useless canada prize useful ipad sxsw,1,-0.1,83,13
1159,what's laptop rt mention think may go ipad laptop today sxswi sxsw cont link,1,0.0,76,14
1160,josh clark's sxsw session ipad/tablet development first note ipad leisure/planning/restful device tapworthy webvisions,1,0.25,118,13
1161,mention last least get copy stupid game plus iphone link also special sxsw price,1,-0.22857142857142856,80,14
1162,ipad sell retail stores...except sxsw pop store austin igottagetit,1,0.0,66,9
1163,sell go new buyer wow link via mention mention sxsw,1,0.11818181818181818,51,10
1164,hold new ipad envy baby still work well sxsw,1,0.13636363636363635,44,9
1165,lovin apple amp austin sxsw,1,0.0,27,5
1166,cant handle sxsw traffic rt mention dear mention app iphone suck day crash,0,0.0,74,13
1167,double buzz issue iphone io get annoy news iphone may fly across room sxsw,0,0.4,74,14
1168,tech apple head sxsw set temporary store austin link,1,0.0,52,9
1169,quot;apple elegant fascist company america.&quot flipboard sxsw,0,0.5,63,7
1170,quot;apple like pay that's apple likes.&quot barry diller sxsw mention acc ballroom pic link,0,0.0,92,14
1171,tech apple open pop-up store austin sxsw link,1,0.0,45,8
1172,sxsw apple pick great venue launch new ipads,1,0.4681818181818182,44,8
1173,cool apple set sq ft temporary store sxsw sell ipad link,1,0.35,56,11
1174,popup apple store open sxsw love go right middle action link via mention,1,0.17714285714285713,72,13
1175,sxsw apple store run day boo apple,0,0.0,34,7
1176,japan apple store serve rally point massive quake link entry friend house sxsw,1,0.0,78,13
1177,apple naomi campbell pop-up store rage link sxsw,0,0.0,48,8
1178,cool apple open temporary store sxsw link sxsw,1,0.175,46,8
1179,nice apple open pop-up store sxsw across office link,1,0.3,52,9
1180,quot;apple elegant fascist corporation america today.&quot kara swisher sxsw flipboard,0,0.5,86,10
1181,temp apple$tore set sxsw yay link austin tech,1,0.0,45,8
1182,learn design headache ipad sxsw,0,0.0,31,5
1183,ready learn quot;designing ipad interface new navigation schemas&quot sxsw uxdes,1,0.16818181818181818,80,10
1184,plane leave sxsw never see many apple device one plane,1,0.5,54,10
1185,barry diller say ipad-only magazine like daily make sense link sxsw,0,0.0,67,11
1186,barry diller say silly write content one form factor apple like get money sxsw,0,-0.5,78,14
1187,barry diller truly emotional thing ipad harlow diller quot;it's better.&quot sxsw,1,0.0,81,11
1188,barry diller's pragmatic straight forward nice look like want grab pitchfork apple sxsw,0,0.4,87,13
1189,mention let's go apple store score ipad sxsw widfy,1,0.0,50,9
1190,sxsw go let's rate amp review session although experience iphone bit torturous,0,0.0,78,12
1191,clever come first day sxsw pop apple store right indoor town austin clever,1,0.21726190476190474,74,13
1192,aron pilhofer new york time endorsed html ipad newsapps sxsw ask tweet actually say,1,0.06818181818181818,83,14
1193,si julie life death rockaroke struggle win ipad fandango sxsw party hole bad religion far,1,0.06666666666666674,89,15
1194,want likability virgin trustworthiness zappos product apple mention pnid sxsw enchantment,1,0.0,89,11
1195,first line mention sxsw mention store mention apple store sxsw pic link,1,0.25,71,12
1196,apple sell ipad sxsw california great building cult following link,1,0.4,66,10
1197,who's kill chevytweethouse mention ipad dj sxsw link,1,0.0,52,8
1198,delivery pop mention store mention quite possible sxsw sxswi link,1,0.0,65,10
1199,ipad take sxsw i'm prepare fun weekend career,1,0.3,45,8
1200,omg still line new ipad dieing hunger sxsw else line,1,0.13636363636363635,52,10
1201,welcome ipad owner new use ipad owner there's room everyone party sxsw postpc,1,0.4681818181818182,77,13
1202,look people sxsw ipad shame,0,0.0,27,5
1203,want yall know apple build pop store day sell wow sxsw link,1,0.1,59,12
1204,hello holler gram come take look new first ipad app link hollergram sxsw,1,0.19318181818181818,72,13
1205,realllllllly need upgrade phone haha rt mention iphone apps youûªll probably need use sxsw link,1,0.2,96,15
1206,really good look today mention sxsw apple fanboy impress,1,0.7,56,9
1207,download asddieu app preparation sxsw pump need check link app event network,1,0.0,76,12
1208,rumour location apple pop store iun austin texas sxsw...cheers link,0,0.0,67,10
1209,mention lol sxsw apple pop store ipad fly shelf hipster feed frenzy,1,0.8,67,12
1210,wow long queue people apple pop store buy ipads sxsw@mention room#nokiaconnects,1,0.025,79,11
1211,mention look like could get link apple sxsw,1,0.0,43,8
1212,expect lot buzz ipad sxsw since come tomorrow support flash maybe link elonsxsw,1,0.0,79,13
1213,kinda jealous ubiquity ipad's here...#sxsw,1,0.0,42,5
1214,mention love get one pop-up apple store sxsw attendee,1,0.5,53,9
1215,mention love y'all sxsw come i'm get login authorization error almost every time open app iphone,0,0.25,96,16
1216,apple employee psyche line pop shop sxsw moment ipad go sale link,1,0.0,65,12
1217,hey lucky dog sxsw ipads check holler gram app link,1,0.3333333333333333,51,10
1218,mr heavenly aka band michael cera ready rock bat bar sxsw iphone camera de rigeur,1,0.2,81,15
1219,hmm....only sxsw right-brain left-brain rt mention mention sxsw attendee mac ipad,1,0.0,81,11
1220,beautifully smart simple idea rt mention mention write hollergram ipad app sxsw link,1,0.10714285714285714,84,13
1221,know i'm late game really dig flipboard ipad sxsw,1,-0.16666666666666666,49,9
1222,sad i'm miss ipad launch south sound chill sxsw ipad jk,1,-0.04999999999999999,55,11
1223,mention massive line sxsw apple store...agree wait perhaps late early adopter,1,-0.06666666666666667,77,11
1224,want time say ipad rt mention schedule heavy laptop where's ipad already sxsw,1,-0.2,77,13
1225,omg sign rt mention we're officially sxsw come mention grill amp youûªll get make iphone case,1,0.0,94,16
1226,yup rt mention mention sxsw quot;apple come cool technology one's ever hear go conferences&quot,1,0.35,95,14
1227,yawn rt mention apple set open pop-up shop sxsw interactive conference link apple,1,0.0,81,13
1228,yay rt mention apple open temp store austin sxsw link via mention,1,0.0,65,12
1229,rock mention note sxsw work awesome mbp iphone app sync transparently,1,1.0,69,11
1230,guess mention excuse get ipad link sxsw,1,-0.05,39,7
1231,haha rt mention many use apple cause one use windows voluntarily kawasaki thisisdare sxsw,1,0.35,89,14
1232,yay rt mention hoot new blog post hootsuite mobile sxsw update iphone blackberry amp android link,1,0.13636363636363635,97,16
1233,haha rt mention i'll bet there's lot nerd sxsw use iphone light saber app barroom brawl instead fist,1,0.30000000000000004,100,18
1234,lol rt mention i'll bet there's lot nerd sxsw use iphone light saber app barroom brawl instead fist,1,0.6000000000000001,99,18
1235,cool rt mention rumor apple open temporary store downtown austin sxsw ipad link,1,0.175,79,13
1236,srsly ûï@mention rumor apple temporary store downtown austin sxsw ipad launch link,1,0.0,83,12
1237,yup rt mention ipad envy roof thanks every person sxsw,1,0.2,54,10
1238,wow rt mention pop-up apple store seem pop-up sxsw,0,0.1,50,9
1239,fab rt mention rt mention mention spill bean next platform flipboard iphone.workin sxflip sxsw sxswi,1,0.0,100,15
1240,lucky ûï@mention rt mention score mophie juice pack tradeshow sxsw double iphone battery!û,1,0.16666666666666666,93,13
1241,sweet mention rt mention open temporary store downtown austin sxsw ipad launch link,1,0.175,83,13
1242,thanks mention we're lovin mention app update iphone sure download amp familiarize sxsw usguys,1,0.35,94,14
1243,mention might need go apple today think quot;s&quot quot;x&quot quot;w&quot key wear sxsw,0,0.0,89,13
1244,get mine amp disagree rt mention peter cashmore ipad minor improvement worth unless burn sxsw,0,0.125,93,15
1245,within month ipad severely autistic year old master puzzle game sxsw poursite,1,-0.16666666666666666,77,12
1246,initial impression white ipad awesome seem much quick web browse even shitty wifi sxsw,1,0.3333333333333333,86,14
1247,apple trump nvidia tablet game link entry friend house sxsw,1,-0.4,59,10
1248,really tempt get ipad sxsw,1,0.2,26,5
1249,apple seem win app world sxsw,1,0.8,29,6
1250,seattle sxsw peep today replacement iphone hand i'm back action,1,0.05,63,10
1251,mention twitter iphone app day head sxsw want tweet lot help,0,0.0,60,11
1252,restore apple make smart phone i'm unleash hell sxsw,1,0.21428571428571427,52,9
1253,get hand ipad sxsw mixed feeling magnetic cover overall great improvemnt,1,0.26666666666666666,72,11
1254,get ipad courtesy pop store austin yay sxsw allow amount available ipads rise,1,0.4,77,13
1255,get ipad white wifi blue cover thing sell sxsw apple store link,1,0.0,63,12
1256,mention iphone crash amp fresh restore amp lose fave dali/canvas pak ever get back also mention sxsw,0,0.15,100,17
1257,today last day apple pop-up sxsw vacation start tomorrow great experience,1,0.4,73,11
1258,time late night purchase sxsw mention apple store sxsw others link,1,-0.3,66,11
1259,get mophie juice pack plus iphone i'm ready sxsw double battery life ftw,1,0.1,72,13
1260,sound voice shot exploit apple amp best buy's return policy imacs brilliant sxsw,1,0.7666666666666666,80,13
1261,rt@mention crowley cashmore think ipad minor step tell people stand line sxsw apple pop-up store,1,-0.05,96,15
1262,lose hour tonight sxsw attendee blame microsoft apple get credit fix christmas,1,0.0,78,12
1263,please hear people talk ipad preferrably sxsw hashtags really deficit life,0,0.2,74,11
1264,sxsw tron ipad app swish behind scenes footage amp director note syncs blueray playing film,1,-0.4,91,15
1265,think ipad eminent type thoughtful note phone work mac book big handwriting ridic sxsw day conquer,1,0.2,98,16
1266,verizon iphone kick hairy butt sxsw how's at;t phone sxsw,1,0.0,57,10
1267,verizon iphone kick hairy butt sxsw how's at;t phone sxsw link,1,0.0,62,11
1268,lisa cohen announce mention iphone app month sweet comcom sxsw,1,0.35,62,10
1269,want line unconfirmed apple pop-up store ipad sxsw,1,0.0,50,8
1270,wait line ipad say may left...crossing finger sxsw,1,0.0,50,8
1271,rt@mention love mention sxsw quot;apple come cool technology one's ever hear go conferences&quot,1,0.425,96,13
1272,order week wait rt mention decide need ipad usguys sxsw,1,0.0,55,10
1273,never see many apple product life sxsw,1,0.5,38,7
1274,podcast social business summit austin link mention mention sxsw listen new iphone delight,1,0.08484848484848484,89,13
1275,rt@mention t's rumor apple open temporary store downtown austin sxsw ipad launch link,1,0.0,85,13
1276,sit floor behind guy who's fondle new ipad disturb way sxsw,0,-0.13181818181818183,59,11
1277,sit ground wait ipad austin apple popup store sxsw geek link,1,0.0,60,11
1278,window scarborough building corner amp congress black apple pop-up store born sxsw welivehere,1,-0.16666666666666666,93,13
1279,i've take sxsw iphone ipad apps grant realize amaze apps big applause designers/devs sxsw,1,0.0,89,14
1280,fun mention new check-in's feature iphone see mention late article quot;roll link sxsw,1,0.04545454545454545,86,13
1281,mike tyson want iphone knockout sxsw cnet blog link,1,0.0,51,9
1282,rt@mention what's go sxsw today share photo video ireport link cnn iphone app,1,0.0,77,13
1283,apple rt mention woke sandwich iphone ipad forget much sxsw like geek spring break,1,0.2,82,14
1284,get ipad i'm sxsw yes depress,1,-0.06666666666666667,29,6
1285,lol see single pc user around meûójust macbooks ipads web devs definitely apple folk sxsw apple,1,0.24285714285714288,96,16
1286,grouped{in nice app group aber leider nur fì_r iphone link sxsw,1,0.6,63,11
1287,ipad sync complete i'm live livingthedream sxsw,1,0.11818181818181818,47,7
1288,test ncaa mmod ipad app sxsw session flawless livesteam bracket show at;t ad atrix make sense mute though,1,1.0,105,18
1289,cancel trip austin sxsw today/i'm weather find great itunes mix sxsw artist amp free!{link,1,0.8,90,14
1290,include emotional thing ipad barrydiller sxsw pnid,1,0.0,50,7
1291,james franco go note sxsw speech ipad android world get ipad day ago feel like expert already,1,0.0,93,17
1292,crowley cashmore think ipad minor step tell people stand line sxsw apple pop-up store checkins,1,-0.05,94,15
1293,wow demand ipad insatiable seem sell everywhere austin texas suppose sxsw town help,1,0.1,83,13
1294,line around corner sxsw say wait i've already get two camera iphone sorry apple,0,-0.5,79,14
1295,anyone find makeshift apple store sxsw yet,1,0.0,42,7
1296,surround lot ipad box sxsw,1,0.0,26,5
1297,sxsw attendees come see aquent booth sxsw trade show might win ipad,1,0.8,67,12
1298,bereft wanderer white cord limp lifeless outlet iphone sxsw poetry,0,-0.1,66,10
1299,hey vufinders awesome new update mention iphone app link speedup object tag outside sxsw conf hour,1,0.37878787878787873,98,16
1300,really find enjoy ipad design principle well do tapworthy useful clear point throughout sxsw,1,0.25000000000000006,92,14
1301,cant handle everyone's tweet new flipboard jealous think take plunge buying ipad sxsw,1,0.13636363636363635,85,13
1302,man panhandle ipad sxsw whatûªs world come ipad apple tablet sxsw,0,0.0,66,11
1303,domo iphone amp android app share facebook stranger link via mention domo sxsw,1,0.0,78,13
1304,iphone sxsw app would pretty awesome crash every extend browsing fuckit illmakeitwork,0,0.625,85,12
1305,best iphone accessory sxsw link rockstache techsmith istache via mention,1,1.0,72,10
1306,sxsw iphone app awesome ipad app crash every time sxsw,0,1.0,54,10
1307,i'm line ipad mention mention sxsw,1,0.0,34,6
1308,anyone news sxsw ipad must-have course link,1,0.0,43,7
1309,anyone know mention store sxsw still ipad stock,1,0.0,47,8
1310,ask one booth people apple pay every single booth show product say idontbelieve sxsw,0,-0.07142857142857142,84,14
1311,one least helpful session sxsw leave session amp read ipad design note instead link uxdes,1,-0.3,89,15
1312,one three best apps we've see sxsw link,1,1.0,39,8
1313,apple open pop-up store sxsw release ipad quite scene geek power link,1,0.0,69,12
1314,lonely job protect ipad someone gotta link sxsw,1,-0.09999999999999998,47,8
1315,internet blur link ipad fade link ûò mention sxsw,0,0.0,50,9
1316,mention new ipad apps speech therapy communication showcased mention sxsw conference link sxswi assistivetech,1,0.13636363636363635,109,14
1317,mention new ipad apps speech therapy communication showcased sxsw conference link augcomm hcsm mhealth,1,0.13636363636363635,102,14
1318,covet new ipad link sxsw,1,0.13636363636363635,24,5
1319,buy new ipad's mention geekdate apple sxsw,1,0.13636363636363635,42,7
1320,random news tech exclusive shot sxsw popup apple store link tt ff,1,-0.5,65,12
1321,mention news sxsw lot ipad bash everyone want one even mention consistent theme,1,0.25,79,13
1322,guy next use ipad periscope sxsw,1,0.0,32,6
1323,sweet danfung dennis demo immersive video rig ipad platform use hell back sxsw party,1,0.175,84,14
1324,i'm look forward smcdallas pre sxsw party wed hop i'll win ipad result shameless promotion chevysmc,1,0.8,99,16
1325,tweet sxsw pretty non existent today thanks mention iphone app fail hootsuite epic replacement owllove,0,0.012500000000000004,102,15
1326,i'm miss apple's even open temporary store downtown austin say mention hope mention get passport sxsw,1,0.0,101,16
1327,interesting presentation building netflix iphone app sxsw link,1,0.5,62,8
1328,well ipad really perfect device sxsw,1,1.0,36,6
1329,still use original first-generation iphone wonder get kick sxsw,0,0.375,63,9
1330,interesting tidbit apple design ipad case design actual device sxsw,1,0.25,67,10
1331,who's go sxsw apple store there....{link aapl,1,0.0,45,7
1332,go mock tech-nerds come sxsw stand line ipad remember horror movie,0,0.0,66,11
1333,interest see yellow page ipad app come example good practice sxsw,1,0.35,65,11
1334,start think blackberry like abacus phone damn iphone sxsw want abacus,0,0.0,69,11
1335,ipad unload sxsw popup store awesome link,1,1.0,41,7
1336,ipad lounge mention free daily sxsw free coffee ipad art recharge refresh åç austin detail link,1,0.26666666666666666,95,16
1337,mention nice meeting last night confession instal mention ipad amp really like sxsw,1,0.26666666666666666,83,13
1338,mention nice move apple sxsw center apple fanboy-dom next week,1,0.16666666666666666,62,10
1339,mention nice vid ipad sxsw hope mention behind camera link,1,0.09999999999999998,58,10
1340,mention nice work organize apple pop-up store wish austin sxsw,1,0.6,62,10
1341,apple open pop-up store sxsw cool another reason i'm pissedimnotgoingtosxsw link,1,0.175,80,11
1342,apple open store downtown atx wknd time sxsw ppl buy ipad ûï@mention link,1,0.0,74,13
1343,apple open downtown austin pop store sxsw rt mention even begin apple win sxsw link,1,0.4,83,15
1344,apple open pop-up store austin congress sell new ipads sxsw link,1,0.06818181818181818,64,11
1345,apple open pop-up store austin sxsw link phew begin panic thanks steve sxsw,1,0.1,75,13
1346,apple open pop-up store austin sxsw link lt ya gotta hand apple always innovate apple sxsw,1,0.0,90,16
1347,i'm listen get talib kweli via discovr app iphone i'm plane sxsw love gogo link,1,0.5,79,15
1348,great even mention mention karateka castle wolfenstein choplifter apple classic sxsw,1,0.48333333333333334,84,11
1349,also thanks apple release ios time sxsw instal leaving home,1,0.2,59,10
1350,"dan neumann announce launch organic's first consumer-facing ipad app broadfeed sxsw 
check",1,0.25,90,12
1351,gonna want iphone apps head sxsw today hot one download away link,1,0.25,65,12
1352,mypov winner popup apple store chevy cruze loser investor prop frothy startup enterprise strategy sxsw,1,0.0,102,15
1353,keep win shit thanks mention killer ipad case sxsw,1,0.26666666666666666,50,9
1354,mention buy ipad i'd wait ipad teleport capability sxsw,0,0.0,55,9
1355,technology happen iphone nokia pushsnowboarding sxsw,0,0.0,52,6
1356,even word much wireless sxsw suck thank goodness iphone,1,0.2,55,9
1357,mention shill ipad underestimate appeal link newsapps sxsw,1,0.0,58,8
1358,ipad another reason i'd love mention sxsw,1,0.5,41,7
1359,nothing quite like sxsw make want ipad desperately almost drool guy's next,1,-0.3,74,12
1360,nothing sillier watch people record video ipad sxsw,0,0.0,51,8
1361,agree ûó novelty ipad news apps fade fast among digital delegate ûó link medium sxsw via mention,0,0.1,98,17
1362,quot;i know i'm right apple&quot sxsw,1,0.2857142857142857,37,6
1363,think shoulda go sxsw year first year ipad could interest session sxsw,1,0.25,70,12
1364,wanna know rt mention one producer go sxsw hopefully free iphone apps dl,1,0.4,72,13
1365,anybody know whether nab white austin sxsw apple popupstore,1,0.0,59,9
1366,know would original content anything today's world.(and ipad well barry diller sxsw,1,0.375,83,12
1367,apple open quot;pop-up&quot store sxsw rt mention smart well play fruit co link via mention,1,0.10714285714285714,91,15
1368,see ton around guess take long get sxsw apple store line mention,1,-0.05,64,12
1369,apple open temporary store sxsw sell ipad link tnw,1,0.0,50,9
1370,sxsw sponsor apple plaid boys i'm attract,1,0.0,41,7
1371,consumerist's quot;worst company america tournament bracket apple pit microsoft first round sxsw,0,0.024999999999999994,96,12
1372,enchantment get trustworthiness zappos likeability virgin product apple mention sxsw,1,0.0,84,10
1373,ipad contest full-swing great see many actsofsharing.com still plenty time join fun sxsw,1,0.5333333333333333,88,13
1374,fully anticipate every geek-douche tot ipad sxsw people also worth go,0,0.3,69,11
1375,invent quot;dislike&quot button ipad line link sxsw,0,0.0,51,7
1376,mention sxsw make impossible succumb upgrading ipad year old amp feel like i'm walk around bag phone,1,-0.2833333333333333,100,17
1377,use mention sxsw get updates temp apple store line super impress potential app nice work yobongo,1,0.3111111111111111,96,16
1378,love mention hangover breakfast awesome swag yummy food amp rockin tune stoke griffin cordless iphone charger sxsw,1,0.75,114,17
1379,rt mention love mention sxsw quot;apple come cool technology one's ever hear go conferences&quot,1,0.425,96,14
1380,rt mention love mention sxsw quot;apple come cool technology one's ever hear go conferences&quot,1,0.425,96,14
1381,grrrr mention mute sxsw think web iphone,0,-0.7,40,7
1382,sxsw mention omit flash apple seem effective even though maybe need break old thing browserwars,1,0.35,95,15
1383,rt mention quantter launch iphone app soon we're participate launchrock comp sxsw link,1,0.0,86,13
1384,rt rt mention ipad take sxsw video link rt mention ip link vega news,1,0.0,68,14
1385,hhaha mention intimidate iphone app developer meetup leave sxsw,1,0.0,63,9
1386,mention write hollergram ipad app sxsw link,1,0.0,43,7
1387,walk pop-up apple store like walk future ipad type computer sxsw,1,0.0,64,11
1388,organic unveils broadfeed social news app ipad audience get head door sxsw,0,0.03333333333333333,74,12
1389,convention center get stuff ready sxsw thank god iphone,1,0.05,55,9
1390,ipad envy great waaaaaa sxsw,1,0.8,28,5
1391,head quot;your mom ipad design boomers&quot hope fun sxsw,1,0.3,57,9
1392,head sxsw later week sure download heattracker iphone ipod touch know what's hot what's austin,1,0.25,94,15
1393,talk year old iphone developer genius come sxsw proud dad sxsw mention bd riley's irish pub link,0,0.3,96,17
1394,willing admit i'm tiny bit jealous sxsw-bound temperature high apple pop ipad what's love,1,0.2275,89,14
1395,head austin sxsw wkend love mention set pop-up store amp congress deal mass geek influx release,1,0.5,95,16
1396,head austin sxsw mention austin guide iphone free limited time link lp travel,1,0.1642857142857143,77,13
1397,tried buy ipad week sxsw apple store every time go sold one want,1,0.0,64,13
1398,connectivity iphone smart phone joe berry sxsw connectedcar,1,0.21428571428571427,59,8
1399,need get ipad mention apple open temp store downtown austin sxsw ipad launch via mention,1,0.0,88,15
1400,decide go la instead sxsw at;t iphone would useful brick austin,0,0.3,63,11
1401,curious know devs think ref iphone android development sxsw buzz still seem favour iphone year,1,-0.1,94,15
1402,excited meet mention team way apple store go download app sxsw link,1,0.375,67,12
1403,iphone old sxsw schedule app oh no rejection,0,0.1,44,8
1404,pleased see josh clark feature mention client ipad design presentation sxsw,1,0.5,75,11
1405,sure stop sxsw booth today show one game run ipad could get free gift sxsw,1,0.16666666666666666,74,15
1406,go apple store kingston friends sxsw new ipad's get something cheer link,1,0.13636363636363635,72,12
1407,there's way call ipad count sxsw reasonable think there's one every people,0,0.2,74,12
1408,mine toooo rt mention ipad envy roof thanks every person sxsw,1,0.2,61,11
1409,find road dawg check ipad store sxsw mention,1,0.0,44,8
1410,two ipad observation sxsw vast majority people use see lot today look nice appletakingoverworld,1,0.3,95,14
1411,apple autocorrect weird ogilvy autocorrects idiocy ogilvynotes sxsw,0,-0.4,67,8
1412,sweet good mention ipad verizon life peak sxsw,1,0.5249999999999999,46,8
1413,oh god sxsw app ipad pure unadulterated awesome easy browse event ipad website,1,0.5119047619047619,78,13
1414,speak sxsw apple store congress great permanent,1,0.8,47,7
1415,honor apple's sxsw pop-up shop thought landlord amp lease agent utilize pop-up shop link,1,0.0,88,14
1416,cashmere mashable think ipad huge step wait apple pr team parachute sxsw session,0,0.4000000000000001,80,13
1417,aron pilhofer new york time design guru khoi vinh express scepticism ipad news apps sxsw link,0,0.13636363636363635,93,16
1418,join actsofsharing.com tonight person friend city end sxsw win ipad,1,0.8,67,10
1419,apple google at;t surplus cash brand loyalty/mobile leash make mobile payment easy bankinnovation sxsw,1,0.43333333333333335,102,14
1420,mention oh hey remember even bring laptop sxsw panel ipad life,1,0.0,62,11
1421,"go sxsw wish could purchase ipad worry link 

well play apple well play",1,0.0,71,13
1422,look crowd sxsw everyone head look ipad phone place socially awkward quot;cool&quot,1,-0.6,83,12
1423,really cool rt mention stop let make custom iphone case zazzlesxsw sxsw sxswi link link,1,0.35,87,15
1424,two year old show howmto use ipad usdes sxsw,1,0.1,44,9
1425,scene austin sxsw ipad pop-up shop arrive link sxsw cnnmoneysxsw,1,0.0,64,10
1426,there's something say sxsw gadget choice every session ipad macbookpro blackberry nothing else,1,0.0,94,13
1427,"rt mention 
the ipad take sxsw link",1,0.0,35,7
1428,rt mention study player tell quot;petting iphone make happy.&quot tapworthy sxsw,1,0.0,80,11
1429,rt mention rumor apple open temporary store downtown austin sxsw ipad launch link,1,0.0,81,13
