,tweet_text,pos_rev,polarity,review_len,word_count
0,iphone hr tweet rise_austin dead need upgrade plugin station sxsw,0,-0.2,65,10
1,jessedee know fludapp awesome ipad/iphone app likely appreciate design also they're give free sxsw,1,0.4666666666666666,98,14
2,swonderlin wait ipad also sale sxsw,1,0.0,35,6
3,sxsw hope year's festival crashy year's iphone app sxsw,0,0.0,55,9
4,beautifully smart simple idea rt madebymany thenextweb write hollergram ipad app sxsw http://bit.ly/ieavob,1,0.10714285714285714,106,13
5,count day sxsw plus strong canadian dollar mean stock apple gear,1,0.060416666666666646,64,11
6,great sxsw ipad app madebymany,1,0.8,30,5
7,haha awesomely rad ipad app madebymany http://bit.ly/htdfim hollergram sxsw,1,0.6,75,9
8,noticed dst come weekend many iphone user hour late sxsw come sunday morning sxsw iphone,0,0.1,88,15
9,add sxsw flight planely match people planes/airports also download klm iphone app nicely do,1,0.6,91,14
10,must sxsw app rt malbonster lovely review forbes sxsw ipad app holler gram,1,0.5,74,13
11,need buy i'm austin sxsw sure i'll need austin apple store,1,0.5,58,11
12,oh god sxsw app ipad pure unadulterated awesome easy browse event ipad website,1,0.5119047619047619,78,13
13,photo instal sxsw iphone app really nice,1,0.6,40,7
14,rt laurieshook i'm look forward smcdallas pre sxsw party wed hop i'll win ipad result shameless promotion chevysmc,1,0.8,114,18
15,rt haha awesomely rad ipad app madebymany http://bit.ly/htdfim hollergram sxsw via michaelpiliero,1,0.6,97,12
16,new look like go rock update iphone android push tonight http://bit.ly/etsbzk sxsw keepaustinweird,1,0.13636363636363635,98,13
17,smart madebymany hollergram ipad app sxsw may leave vuvuzela home,1,0.21428571428571427,65,10
18,must app ipad go sxsw hollergram,1,0.0,32,6
19,best rt mention ha first line sxsw quot;pop-up&quot apple store event planner eventprofs pcma,1,0.625,93,14
20,mention great weather greet sxsw still need sweater night..apple put quot;flash store&quot downtown sell,1,0.8,104,14
21,û÷#smartcoverûª open instant access wait get one link apple sxsw,1,0.0,66,10
22,hooray rt ûï@mention apple open pop-up store austin sxsw mention link,1,0.0,70,11
23,wooooo ûï@mention apple store downtown austin open til midnight sxswû,1,0.0,72,10
24,link rt mention stop sxsw chaos amp mention hunt austin java get spy game chance win ipad,1,0.2,89,17
25,omfg rt mention hear apple's pop-up store downtown austin pic already gowalla link sxsw,1,0.0,87,14
26,smile rt mention think apple's quot;pop-up store&quot austin would lot interest actually know popped sxsw,0,0.15,105,15
27,attend mention ipad design headache sxsw link,0,0.0,45,7
28,check mention mention amp mention line ipad austin power sxswi sxsw link,1,0.0,72,12
29,love mention iphone case sxsw can't get phone fail,1,0.0,50,9
30,new post mention iphone app make easy connect social network people meet link sxsw,1,0.201010101010101,82,14
31,nice mention iphone app behave today crash yesterday ridiculous sxsw,1,0.13333333333333333,68,10
32,nice rt mention hey apple fan get peek space that's slat pop-up sxsw apple store tomorrow link,1,0.6,94,17
33,thanks mention mention new speech ipad apps showcased sxsw conf link sxswh sxsh,1,0.16818181818181818,79,13
34,mention sxsw provide iphone charger i've change mind go next year,0,0.0,65,11
35,xmas rt mention shiny new mention mention mention apps new garyvee book pop-up ipad store sxsw christmas nerd,1,0.13636363636363635,109,18
36,yai rt mention new ubersocial iphone app store include uberguide sxsw sponsor cont link,1,0.13636363636363635,87,14
37,headline quot;#ipad must-have gadget sxsw&quot hmm could see one come link gadget,1,0.0,81,12
38,kawasaki quot;not c.s lewis level reason apple's continue existence evidence existence god&quot bawl sxsw,1,0.0,105,14
39,kawasaki quot;pagemaker save apple.&quot oh day sxsw jwtatl enchantment via mention,1,0.0,83,11
40,sxsw apple ipad great thought japan apac region deal earthquake amp tsunami trauma sxswi,1,0.8,88,14
41,sxsw apple school marketing expert link,1,0.0,39,6
42,temporary apple store def tent powerhouse gym sxsw link,1,0.0,55,9
43,temporary apple store congress sxsw along happy hipster,1,0.8,55,8
44,ûï@mention apple win sxsw link open temporary store downtown austin support launch good,1,0.5,88,13
45,ipad austin trend today fun sxsw nerdy nerd,1,0.3,43,8
46,christian ipad iphone devs want talk sxsw maybe wk together cool app mention,1,0.175,76,13
47,apple take sxsw austin storm link mention excite part mobile,1,0.0,60,10
48,haz ifrom sxsw link,1,0.0,19,4
49,stack wait buy sxsw get mine hassle apple handle perfectly link,1,1.0,63,11
50,take sxsw rt mention major south korean director get make movie entirely iphone link,1,0.03125,84,14
51,beautiful sxsw mention apple store sxsw pic link,1,0.85,48,8
52,must sxsw app rt mention lovely review forbes sxsw ipad app holler gram link,1,0.5,76,14
53,temporary sxsw apple store apple sneaky usual link,1,-0.25,50,8
54,ûï@mention sxsw beta test interactive book ipad app moonbot studio louisiana cool app.û,1,0.35,90,13
55,apple sxsw day one seeing ton,1,0.0,29,6
56,ûï@mention sxsw ipad store sell everything except wifi whiteû mention manage get,1,0.0,83,12
57,ûï@mention sxsw ipad store sell everything except wifi whiteû also know white jean configuration,1,0.0,99,14
58,offer sxsw ipad promo ninjafinder user fan sxsw suck sxsw,1,0.0,57,10
59,poursite sxsw learn life-changing impact ipad real people's actual live bravo,1,0.11212121212121212,77,11
60,apple sxsw store still ipad short line,1,0.0,38,7
61,anyone sxsw want make quick hundred dollar new ad hoc apple store get hundred plus cost,1,0.23484848484848483,87,16
62,seriously sxsw test mobile apps constant ipad crash cause lose schedule sync,0,-0.16666666666666666,76,12
63,ready sxsw iphone apps make ur blogging easy link sxsw sxswi,1,0.31666666666666665,60,11
64,sxsw...a conflagration doofusness link,0,0.0,38,4
65,attention sxsw'ers link rumor pop-up temporary apple store sxsw ipad launch need,1,0.0,80,12
66,go sxswi lousy ipad sxsw link,1,-0.5,29,6
67,"spent come sxsw 

you've already use ipad 

the wait couple city block 

why sxsw link",0,-0.1,86,15
68,behind email give line iphone compose reply sxsw protip,1,-0.4,55,9
69,like night line around block popup apple store sell sxsw,1,0.0,56,10
70,i'm ipad see wild people say fast still pic terrible sxsw,0,-0.2333333333333333,57,11
71,ipad take sxsw video mention link,1,0.0,33,6
72,many ipad snap away keynote slide sxsw,1,0.5,38,7
73,new post iphone apps we'll use south southwest interactive link sxsw sxswi,1,0.13636363636363635,74,12
74,sxsw day apple store there's still line...and grow link,1,0.0,55,9
75,iphone need car'-use zimride etc share rid sxsw shareable,1,0.0,57,9
76,pick mophie battery case iphone prep sxsw lug around laptop amp use phone huge win last year,1,0.4000000000000001,92,17
77,hobo shotgun video game come ipad/iphone user yes please link sxsw,1,-0.4,66,11
78,build store less hour one big launch company's history get apple sxsw,1,-0.08333333333333333,69,12
79,read groupme sxsw...sounds like incredible app available android phone yet,1,0.65,74,10
80,iphone alarm botch timechange many sxsw'ers freak late flight miss panel behind bloody mary,0,-0.25,91,14
81,shouts lady hold ipad free sxsw show take photo sip free beer cc mention,1,0.4,72,14
82,meant also wish sxsw dyac stupid iphone,0,-0.7999999999999999,39,7
83,rumor apple store open sxsw amp congress sign point yes link,1,0.0,60,11
84,pick ipad sxsw pop apple store minute wait,1,0.0,42,8
85,marketing sale genius link apple sxsw,1,0.0,37,6
86,need sxsw ipad iphone laptop dictaphone vid.camera wow love meet real cerebellum charge people,1,0.26666666666666666,94,14
87,sxsw app iphone ridiculous personal planner next day,1,-0.1111111111111111,52,8
88,find app kyping iphone's geolocation amp release background need patch mention batterykiller sxsw,0,0.0,97,13
89,sxsw app iphone live rsvp event phone amp check sundayswagger.eventbrite.com scoremore,1,0.13636363636363635,86,11
90,sxsw apple quot;pop-up&quot store nut still pack link,0,0.0,53,8
91,course apple build temp store austin texas understand concept corral cattle sxsw,0,0.0,80,12
92,love apple let something like retail store near sxsw keep away open pop-up store link,1,0.19999999999999998,85,15
93,surprise apple open pop-up store austin nerd town sxsw get new link cnet,1,0.06818181818181818,72,13
94,surprise apple open pop-up store austin nerd town sxsw get new ipads link cnet,1,0.06818181818181818,78,14
95,surprise apple open pop-up store austin nerd town sxsw get new ipads link,1,0.06818181818181818,73,13
96,ûï@mention apple great example retail store layed future register checkout line sxsw,1,0.4,85,12
97,ûï@mention apple open temporary store downtown austin sxsw ipad launch link gswsxsw,1,0.0,84,12
98,ûï@mention apple open temporary store downtown austin sxsw ipad launch&quot oh yay traffic,0,0.0,91,13
99,sxsw apple popup store open noon fresh shipment ipad i'm pretty sure i'm go get one finger cross,1,0.21000000000000002,96,18
100,technews apple save sxsw set open pop-up store link tech_news apple sxsw tech,1,0.0,77,13
101,sxsw apple school marketing expert link,1,0.0,39,6
102,sxsw apple school marketing expert link via mention,1,0.0,51,8
103,sxsw apple school marketing expert link via mention lt; true love loathe one marketing like,1,0.425,91,15
104,sxsw apple school marketing expert cnet link,1,0.0,44,7
105,sxsw apple school marketing expert cnet blog link austin atx retail,1,0.0,67,11
106,ûï@mention apple store downtown austin open til midnight sxswû mention there's still time,1,0.0,92,13
107,quot;the apple store mall sunday crowd line fake need fuck dongle.&quot genius let sxsw,0,-0.45,87,14
108,makeshift apple store congress kid amaze sxsw apple,1,0.0,51,8
109,temporary apple store sxsw really cool...as ipad apple sxsw fanboy,1,0.2,66,10
110,temporary apple store set sxsw shit temptation go control,1,-0.2,57,9
111,temporary apple store open congress line already grow ipad view.io link via mention sxsw,1,0.0,88,14
112,temporary apple store block office can't wait see line tomorrow photo come sxsw,1,0.0,79,13
113,ipad news apps last year sxsw link,0,0.0,34,7
114,iphone apps youûªll probably need use sxsw link,1,0.0,48,8
115,ipad apps like software development release start work update sxsw,1,0.0,66,10
116,arrive sxsw mention issue resolve die use iphone app cant login rt@mention mention we're,0,0.0,88,14
117,overheard sxsw quot;the ipad relax computer&quot agree ipad apple,1,0.0,65,9
118,overheard sxsw interactive quot;arg hate iphone want blackberry back&quot shock,0,-0.8,79,10
119,ûï@mention sxsw quot;apple come cool technology one's ever hear go conferences&quot;û,0,0.35,88,11
120,last year sxswi everbody talk ipad year social medium drive revolution year well sxsw,1,0.016666666666666666,85,14
121,long line apple pop store ipad great marketing apple sxsw,1,0.375,57,10
122,knackered home playing ipad update iphone timeline smash partytweets can't make go bed sxsw,1,0.0,91,14
123,overheard mdw i'll second quot;halfway iphone battery already even board plane sxsw&quot amateurhour,0,0.0,100,13
124,technews sxsw apple school marketing expert link tech_news apple jobs_co sxsw tech,1,0.0,82,12
125,huge line apple store austin sxsw crowd trip get new ipad,1,0.2681818181818182,57,11
126,laugh ipad spent week haul macbook everywhere really want ipad shoulder rub sxsw,1,0.13333333333333333,80,13
127,sxsw attendee need qr code reader iphone tweet image badge first get optiscan free,1,0.325,82,14
128,hey sxsw attendees...you hop line apple store four day til new come,1,0.13636363636363635,67,12
129,mention bad apple show late qs process poo-poos idea leave early even quot;i'm creative&quot busy gamestorming sxsw,0,-0.19999999999999996,115,17
130,try balance power power need iphone ipad sxsw ipad suck quick might go airplane mode,0,0.3333333333333333,84,15
131,iphone battery win sxsw,1,0.8,23,4
132,iphone battery can't keep tweet thanks apple sxsw precommerce,0,0.2,61,9
133,fun watch ipadmadness rt mention apple open pop-up store austin sxsw link sxsw,1,0.15,78,13
134,control apple set open popup shop core sxsw action link via mention cc mention,1,0.05,78,14
135,celebrate beauty web mention msft launch amp play new game win link sxsw,1,0.1787878787878788,72,13
136,ûï@mention best thing i've hear weekend sxsw quot;i give ipad money japan relief need ipad mention,0,1.0,99,16
137,ipad better..they time improve sxsw,1,0.0,35,5
138,link go beyond earth hour year share positive action world download earthhour iphone app sxsw,1,0.16363636363636364,93,15
139,impulsive buy friend sxsw gt one selling gen ipad,1,0.0,49,9
140,ûï@mention buy new ipad's mention geekdate apple sxsw,1,0.13636363636363635,54,8
141,someone's buying present rt mention apple open pop-up store austin sxsw link,1,0.0,76,12
142,nice find rsq's mention link sxsw ipad app,1,0.6,42,8
143,excite canûªt wait rt mention apple open temporary store downtown austin sxsw amp ipad launch link,1,0.0,99,16
144,great certain meeting rt mention hello holler gram new ipad app link hollergram sxsw,1,0.3835497835497835,84,14
145,ipad come sxsw guess apple's pretty desperate give attention,0,-0.175,60,9
146,come sxsw sure download sxsw go app schedule location event link,1,0.5,64,11
147,seriously consider leave macbook pro home fly solo ipad week think make work sxsw,1,0.23333333333333336,81,14
148,four day ipad sxsw weekend battlela,1,0.0,35,6
149,iphone dead find secret batphone sxsw,0,-0.30000000000000004,37,6
150,best ipad design big chunky element generous space clarity trump density tap quality trump tap quantity tapworthy sxsw,1,0.5,118,18
151,attend design ipad interface new navigation schema mention great stuff far sxsw,1,0.34545454545454546,79,12
152,barry diller think ipad content nut mention sxsw mention link mention,0,0.0,69,11
153,japan docomo introduce mobile apps six year apple come app store jpmobilesummit sxsw,0,0.0,84,13
154,jeez guy dunno apple pop-up gold's gym realize un-jobs-aesthetic sxsw apple,0,0.0,75,11
155,even begin apple win sxsw link tc apple,1,0.8,39,8
156,even begin apple win sxsw link mention,1,0.8,38,7
157,even begin apple win sxsw link open temporary store downtown austin support launch genius,1,0.4,89,14
158,even begin apple win sxsw techcrunch link ipad,1,0.8,46,8
159,even begin apple win sxsw link,1,0.8,30,6
160,even begin apple win sxsw link,1,0.8,30,6
161,even begin apple win sxsw link,1,0.8,30,6
162,even begin apple win sxsw link mention mention,1,0.8,46,8
163,even begin apple win sxsw link via mention mention mention,1,0.8,58,10
164,even begin apple win sxsw link mention,1,0.8,38,7
165,even begin apple win sxsw link via mention,1,0.8,42,8
166,even begin apple winsåê#sxsw link gt gonna get sum via mention,1,0.0,62,11
167,even begin apple win sxsw techcrunch link sxsw,1,0.8,46,8
168,even begin apple win sxsw link lt; win big sxsw,1,0.5333333333333333,47,10
169,even begin apple win sxsw link apple pm sxsw,1,0.8,44,9
170,even begin apple win sxsw link apple sxsw tc,1,0.8,44,9
171,even begin apple winsåêsxsw link apple sxsw,1,0.0,43,7
172,even begin apple win sxsw link tc apple sxsw,1,0.8,44,9
173,even begin apple winsåêsxsw link via mention apple sxsw,1,0.0,55,9
174,even begin apple win sxsw link via mention mention apple sxsw,1,0.8,61,11
175,best swag ever thank mention charge iphone thanks sxsw link,1,0.6,59,10
176,time everything ipad brand winner sxsw mention link pnid sxsw,1,0.0,61,10
177,hey sxsw exhibitor capture booth experience retrollect disc popular disc win ipad link,1,0.7,86,13
178,sxsw fantastic schedule app iphone bummer still crackberry,1,0.4,58,8
179,photo far best sxsw accessory ipad follow closely margarita link,1,0.55,64,10
180,way figure ipad good replacement make sxsw year,1,0.7,47,8
181,need find good sxsw stream follow inane ipad tweet surely southby,0,0.6,65,11
182,apple follow customer sxsw forbes link alcoholic call û÷enabling.ûª rest call genius,1,-0.25,86,12
183,good news austin-bound apple fanboys link sxsw,1,0.7,46,7
184,hitlantis ipad cool song explorer app hitlantis.com sxsw musicviz,1,0.35,65,9
185,friend sxsw willing pick ipad pay premium dm sxsw atl link,1,0.25,58,11
186,good talk akqas mention ipad interface callback design principle wish go beyond media/marketing example fb sxsw,1,0.7,111,16
187,person front take picture new ipad sxsw,1,0.13636363636363635,39,7
188,marketing genius apple open pop store outside sxsw link,1,0.0,55,9
189,get food forget snap photo win macbook air ipad apple tv sxsw,1,0.8,61,12
190,austin get full sxsw underway tell iphone intermittent brick crowd,0,0.35,66,10
191,sxsw go app available blackberry windows addition iphone ipad android link,1,0.4,74,11
192,want go apple pop-up store i'm afraid i'll leave new ipad sxsw,1,-0.2318181818181818,62,12
193,omg...i'm go sxsw macbook pro ipad ipod galaxy tab techgeek,1,0.0,59,10
194,"check googletv ipad apps connect tv experience sxsw.
{link sxsw connectedtv",1,0.0,75,11
195,"check googletv ipad apps connect tv experience sxsw.
{link sxsw connectedtv fascinating",1,0.7,87,12
196,msc_page guy get tattoo sxsw could win free link sxsw tattoo ipadû link allshare,0,0.6000000000000001,81,14
197,ipad hand awesome dude give cutsies hour line austin apple sxsw win,1,0.9,67,12
198,i've meeting i'm line sxsw popup apple store love place,1,0.5,55,10
199,apple hawk ipad sxsw festival popup store link mention,1,0.0,54,9
200,oh lordy go rt mention time apple store sxsw open pulling trigger,1,0.0,65,12
201,hey sxsw bout donate spend new ipad japan really need thing,0,0.16818181818181818,59,11
202,could forget cell phone today sxsw fail glad ipad lifelinetotheworld,1,0.0,68,10
203,mention iphone hr tweet rise_austin dead need upgrade plugin station sxsw,0,-0.2,73,11
204,mention feel sxsw bad place try amp get ipad everyone try get one techiesunite,0,-0.6999999999999998,78,14
205,love macbook ipad iphone sxsw year one run juice jump next,1,0.25,58,11
206,holy cow get hooked paolo alex backup charger iphone facebook.com/powermat powermatteam sxsw thanks,1,0.03333333333333334,99,13
207,holy cow get hooked paolo alex backup charger iphone facebook.com/powermat powermattteam sxsw thanks,1,0.03333333333333334,100,13
208,thought would use ipad lot sxsw even touch hmmzies,0,0.0,50,9
209,mention i'm beyond frustrated mention samsung moment runaround amp leave att amp iphone enjoy sxsw,1,-0.14999999999999997,98,15
210,hot-spot mention data speed could keep rt mention also thank apple release ios time sxsw,1,0.0,88,15
211,wonder ppl sxsw friday queue convention centre apple store xd i'm still figure wot i'll,1,0.0,87,15
212,hot spot austin gowalla right convention cnt ignite party apple store sxsw sxswi,1,0.26785714285714285,80,13
213,sxsw guy front panel ipad etch-a-sketch case...device wonder iusxsw,0,0.0,67,9
214,need sweet mac goodness sxsw apple set temporary store downtown link,1,0.35,68,11
215,zite intelligent ipad magazine link lt deliciousness sxsw trend youneedthis,1,0.8,75,10
216,tim soo's invisible instrument jaw drop iphone+wii controller link lovemusicapi sxsw,1,0.0,84,11
217,rockin ipad downtown apple sxsw store apple,1,0.0,43,7
218,awesome ipad jailbreak link grateful dead sxsw,1,0.4,46,7
219,new post ipad launch huge line apple pop-up shop austin link sxsw sxswi,1,0.2681818181818182,71,13
220,ûï@mention ipad sell go new buyer report link sxsw socialmedia tech mediaû,1,0.13636363636363635,77,12
221,remain ipad stock sxsw apple store come get one link,1,0.0,52,10
222,ipad accessory bag thanks mention sxsw,1,0.2,38,6
223,sxsw ipad app pure gold mention,1,0.21428571428571427,31,6
224,"check ipad design headaches tablet call morning sxsw.
{link sxsw tapworthy",0,0.0,74,11
225,first ipad design headache tablet call morning sxsw tapworthy,0,0.25,61,9
226,first ipad even exist last year already feel like i'm pull antique everytime use ipad sxsw,0,0.125,90,16
227,turn ipad physical messaging platform holler gram cheeky app build sxsw link,1,0.0,76,12
228,shoot ipad display search result go question later osmpw sxsw,0,0.0,61,10
229,pic ipad-winning performance link sxsw accordion toodamnlucky,1,0.0,61,7
230,fear iphone att slowpoke network sxsw amp sxswmusic,1,0.0,51,8
231,sxsw iphone app mock like money come,0,0.0,36,7
232,sxsw iphone app one bad i've use long time,0,-0.37499999999999994,42,9
233,cool iphone app launch sxsw flypost community bulletin board location learn link link,1,0.35,85,13
234,pedicab iphone charger would epic win sxsw,1,0.45,42,7
235,"check iphone developer meet sxsw.
{link sxsw",1,0.0,44,7
236,quot;the iphone transient device use short burst ipad couch device.&quot mention sxsw,1,0.0,85,12
237,dislike iphone twitter auto shorten link sxsw,0,0.0,45,7
238,mention iphone clearly positively happily sxsw,1,0.8,46,6
239,flipboard develop iphone version android say mention sxsw,1,0.0,57,8
240,iphone overheat many british sound people texas sxsw,0,0.3,52,8
241,link part presentation sxsw good thing crash instead work best iphone/android,1,0.85,77,11
242,ûï@mention walk around sxsw star iphone like everyone else.û ummmm...ditto,0,0.0,77,10
243,iphone wilt stress sxsw,0,0.0,23,4
244,course rt mention sxsw get apple store link geeksrule,1,0.0,53,9
245,gotta get rt mention hey taariq howdy texas fav sxsw app link lt;--android-or get iphone usguys,1,0.0,95,16
246,mention big iphone small pc good big event like sxsw meeting day link,1,0.11249999999999999,69,13
247,i'm bit jealous see sxsw attendee ipad seem obsolete,1,0.0,52,9
248,quot;i'm learn thing screen.&quot old's explanation instantly know use ipad sxsw,1,0.05,80,11
249,ipad keep awake thank god buy sxsw,1,0.0,34,7
250,iphone know sxsw week tough already-dwindling battery help jeebus keep correct curse word,0,-0.3888888888888889,89,13
251,god like sxsw imac macbook iphone blackberry star enough time read book remember,0,0.0,80,13
252,ha seem like gt ûï@mention news sxswi apple's temporary ipad store sxsw wth?û,0,0.0,80,13
253,there's line sxsw apple store ipad day link,1,0.0,43,8
254,saw giant line think movie premiere apple store ipad heard scream premiere sxsw,1,0.0,79,13
255,gotta love mention mention unabashed apple fanboy gt; even begin apple win sxsw link,1,0.65,84,14
256,geeky love rt mention apple open temporary store downtown austin sxsw ipad launch link,1,0.25,86,14
257,mention love mention mention sxsw quot;apple come cool technology one's ever hear go conferences&quot,1,0.425,101,14
258,ûï@mention love mention sxsw quot;apple come cool technology one's ever hear go conferences&quot;û,1,0.425,101,13
259,love marketing genius sxsw rt mention inside apple's temporary store austin link,1,0.5,80,12
260,great vid marty rt mention live unbox front sxsw apple store video link,1,0.4681818181818182,71,13
261,think may go ipad laptop today sxswi sxsw veteran reason,1,0.0,56,10
262,purchase mexican mavis boy amp bear sell first listen thanks sxsw itunes free link itunes,1,0.21250000000000002,89,15
263,think might go weekend without see ipad case twice sxsw,1,0.0,55,10
264,sure mine via ipad rt mention know agnerd dairy relies evernote link sxsw agchat,1,0.5,80,14
265,bum miss sxsw year we're quarantine kiddie cold garageband ipad comfort fb,1,-0.6,74,12
266,love morphie juicepack today recharge iphone worth sxsw,1,0.4,55,8
267,brilliant move apple even begin apple win sxsw link,1,0.8500000000000001,51,9
268,can't ipad intimate together tapworthy designflaws sxswi sxsw,1,0.2,61,8
269,day charger kick bucket heck apple store that's within walk distance sxsw,0,0.0,73,12
270,iphone ipad feel unequipped compare everyone else dang sxsw,0,0.0,59,9
271,ûï@mention new ubersocial iphone app store include uberguide sxsw sponsor mashable link,1,0.13636363636363635,88,12
272,couple new blog random tip awesome iphone app dev link politics behind link sxsw,1,0.05909090909090908,80,14
273,dude next hold use ipad like trophy sxsw lookingforwardtothemusicfest,1,0.0,69,9
274,ûï@mention rumor apple popup store downtown austin sxsw amp ipad launch link smart move many dfcbto,1,0.35714285714285715,100,16
275,buy buy rt mention even begin apple winsåê#sxsw link,1,0.0,52,9
276,fear extend wed gt rt mention rt mention last day apple popup sunday sxsw appleatxdt,1,0.0,84,15
277,quot;all sxsw nothing teem sea iphone addict busy twitter ever engage one anothû cont link,0,0.1,91,15
278,fan new sxsw trend audience share opinion via hold ipad listen annoy,0,0.13636363636363635,68,12
279,power apple people spend hundred dollar attend sxsw spending day wait line ipad,1,0.0,79,13
280,continuum attitude crowdsourcing gap quot;i hear you&quot apple quot;i'll tell you&quot sxsw,1,0.0,92,12
281,tomlinson tx observer say apple subscription data hold big impediment success newsapps sxsw,0,0.15,91,13
282,ûï@mention official sxsw app û÷sxsw goûª link android iphone ipadû lt;thanks!installed,1,0.0,91,11
283,technews omg/jk kiss ipad slap xoom link tech_news jk omg sxsw tech,1,0.0,67,12
284,usa today ipad make good use digital shortcut still look like newspaper mention tapworthy sxsw,1,0.35,94,15
285,iphone one hand caramel macchiato ouch-hiss-hot apparently two pump lava begin sxsw tmsxsw,1,0.05,90,13
286,haz one ûï@mention show mention charge anywhere bar charge iphone whole table want buy one sxswû,1,0.2,99,16
287,apple open quot;pop-up&quot store across street sxsw two week umm genius obvious cough cough,1,0.0,92,14
288,apple open pop-up shop sxsw link lt;---cool concept spend sxsw waiting,0,0.0,70,11
289,apple open makeshift store sxsw available today tempt,1,0.2,53,8
290,hey sxsw new ipad app dexteria available link like facebook link,1,0.2681818181818182,64,11
